,Generic Drug Name,Generic Manufacturer,Brand Name,Approval Date,
1,METOPROLOL SUCCINATE EXTENDED-RELEASE TABLETS USP50 MG,SANDOZ INC.,TOPROL-XL EXTENDED-RELEASE TABLETS 50 MG,5/18/2007,
2,METOPROLOL SUCCINATE EXTENDED-RELEASE TABLETS USP100 MG AND200 MG,KV PHARMACEUTICAL COMPANY,TOPROL-XL EXTENDED-RELEASE TABLETS,5/18/2007,
3,AMLODIPINE BESYLATE AND BENAZEPRIL HYDROCHLORIDE CAPSULES2.5 MG (BASE)/10 MG5 MG (BASE)/10 MG5 MG (BASE)/20 MG AND10 MG (BASE)/20 MG,TEVA PHARMACEUTICALS USA,LOTREL CAPSULES,5/18/2007,
4,BETAMETHASONE DIPROPIONATE LOTION USP (AUGMENTED)0.05%,TARO PHARMACEUTICALS USA INC.,DIPROLENE LOTION (AUGMENTED),5/21/2007,
5,BETAMETHASONE DIPROPIONATE LOTION USP (AUGMENTED)0.05%,ALTANA INC.,DIPROLENE LOTION (AUGMENTED),5/21/2007,
