,Generic Drug Name,Generic Manufacturer,Brand Name,Approval Date,
1,CETIRIZINE HYDROCHLORIDE ORAL SOLUTION1 MG/ML (OTC),PERRIGO R&D COMPANY,CHILDREN'S ZYRTEC (ALLERGY) AND (HIVES-RELIEF,4/9/2008,
2,LEVALBUTEROL HYDROCHLORIDE INHALATION SOLUTION0.31 MG (BASE)0.63 MG (BASE) AND1.25 MG (BASE);PACKAGED IN 3 ML UNIT-DOSE VIALS,BREATH LIMITED,XOPENEX INHALATION SOLUTION,4/9/2008,
3,FLUOROURACIL CREAM USP5%,SPEAR PHARMACEUTICALS INC.,EFUDEX TOPICAL CREAM 5%,4/11/2008,
4,LITHIUM CARBONATE CAPSULES USP600 MG,WEST-WARD PHARMACEUTICAL CORP.,LITHIUM CARBONATE CAPSULES USP,4/15/2008,
5,ESTRADIOL AND NORETHINDRONE ACETATE TABLETS1 MG/0.5 MG,BRECKENRIDGE PHARMACEUTICAL INC.,ACTIVELLA TABLETS,4/17/2008,
6,RIBAVIRIN TABLETS500 MG (NEW STRENGTH),ZYDUS PHARMACEUTICALS USA INC.,COPEGUS TABLETS,4/18/2008,
7,EPOPROSTENOL SODIUM FOR INJECTION0.5 MG (BASE)/VIAL AND1.5 MG (BASE)/VIAL,TEVA PARENTERAL MEDICINES INC.,FLOLAN FOR INJECTION,4/23/2008,
8,DONEPEZIL HYDROCHLORIDE TABLETS5 MG AND10 MG,TEVA PHARMACEUTICALS USA,ARICEPT TABLETS,4/28/2008,
