,Generic Drug Name,Generic Manufacturer,Brand Name,Approval Date,
1,BUPROPION HYDROBROMIDE EXTENDED-RELEASE TABLETS174 MG AND522 MG,WATSON LABORATORIES INC. - FLORIDA,APLENZIN EXTENDED-RELEASE TABLETS,,
2,NAPROXEN AND ESOMEPRAZOLE MAGNESIUM DELAYED-RELEASE TABLETS375 MG/20 MG (BASE) AND500 MG/20 MG (BASE),DR. REDDY'S LABORATORIES LIMITED,VIMOVO DELAYED-RELEASE TABLETS,,
3,NORETHINDRONE AND ETHINYL ESTRADIOL TABLETS USP1 MG/0.05 MG,FAMY CARE LTD.,OVCON-50 TABLETS,8/5/2013,
4,GATIFLOXACIN OPHTHALMIC SOLUTION0.5%,LUPIN LIMITED,ZYMAXID OPHTHALMIC SOLUTION,8/28/2013,
5,DEXMETHYLPHENIDATE HYDROCHLORIDE EXTENDED-RELEASE CAPSULES30 MG,MYLAN PHARMACEUTICALS INC.,FOCALIN XR EXTENDED-RELEASE CAPSULES,8/28/2013,
6,ADEFOVIR DIPIVOXIL TABLETS10 MG,SIGMAPHARM LABORATORIES LLC,HEPSERA TABLETS,8/29/2013,
7,ADENOSINE INJECTION USP3 MG/ML; PACKAGED IN60 MG/20 ML AND90 MG/30 ML SINGLE-DOSE VIALS,TEVA PHARMACEUTICALS USA,ADENOSCAN INJECTION,8/29/2013,
8,LANSOPRAZOLE DELAYED-RELEASE CAPSULES USP AMOXICILLINCAPSULES USP ANDCLARITHROMYCIN TABLETS USP30 MG/500 MG/500 MG,TEVA PHARMACEUTICALS USA,PREVPAC,8/30/2013,
9,DOXERCALCIFEROL INJECTION2 MCG/ML; PACKAGED IN4 MCG/2 MLSINGLE-USE AMPULES,INNOPHARMA INC.,HECTOROL INJECTION,8/30/2013,
